"序号","单词","分类","音标","词性","中文","词源/记忆技巧","级别","常考题型","常见搭配","易混淆","例句","真题考法"
"67","pepper","调味","/ˈpepə/（英）  /ˈpepər/（美）","n.","胡椒；甜椒","Pepper 有两个常见意思：黑胡椒粉（black pepper）和彩甜椒（red/green pepper）！它来自拉丁语 piper（胡椒）。想象""pépè（爷爷）""在厨房撒 pepper——既可能是胡椒粉，也可能是红甜椒！","KET 核心词汇","听力 Part 2（做菜/调味）；阅读 Part 3（食谱/购物清单）","black pepper（黑胡椒）；salt and pepper（盐和胡椒）；red pepper（红椒）；pepper shaker（胡椒瓶）","pepper（甜椒/胡椒）vs chilli（辣椒）——pepper 的甜椒不辣，chilli 才辣；black pepper 是粉末调料","Can you pass the salt and pepper, please? 请把盐和胡椒递给我好吗？","阅读食谱选""需要什么调料""，或听对话判断""要 salt 还是 pepper"""
"68","salt","调味","/sɔːlt/（英）  /sɔːlt/（美）","n.","盐","Salt 来自古英语 sealt，和人类历史一样古老——古代盐非常珍贵！salt 和 sweet（甜）正好相反：一个咸，一个甜。记住：salt 像""索特""——索特在汤里加了一勺 salt（盐）！","KET 核心词汇","听力 Part 2（厨房/做菜）；阅读 Part 3（食谱/健康建议）","salt and pepper（盐和胡椒）；a pinch of salt（一撮盐）；too much salt（盐太多）；sea salt（海盐）","salt（盐）vs sugar（糖）——salt 咸咸的调味品，sugar 甜甜的；两者都是白色颗粒但味道相反","Add a little salt to the soup. 往汤里加一点点盐。","阅读健康文章判断""哪种食物含 salt 太多""，或食谱题选正确调料"
"69","sauce","调味","/sɔːs/","n.","酱；酱汁","Sauce 来自拉丁语 salsus（加盐的），和 salt（盐）是亲戚！酱汁就是加了各种调料的""液体美味""。tomato sauce（番茄酱）、soy sauce（酱油）——sauce 就是让食物更好吃的""魔法液体""！","KET 核心词汇","听力 Part 2（餐厅/做菜）；阅读 Part 3（菜单/食谱）","tomato sauce（番茄酱）；soy sauce（酱油）；pasta sauce（意面酱）；hot sauce（辣酱）","sauce（酱）vs source（来源）——sauce 是食物酱汁读 /sɔːs/，source 是""来源""读 /sɔːs/ 但拼写不同","I like pasta with tomato sauce. 我喜欢番茄酱意面。","听对话判断""意面配什么酱""，或在菜单阅读中识别不同 sauce 名称"
"70","sugar","调味","/ˈʃʊɡə/（英）  /ˈʃʊɡər/（美）","n.","糖","Sugar 来自阿拉伯语 sukkar，通过贸易路线传到欧洲。sugar 和 sweet（甜）是好搭档——加了 sugar 的东西就变 sweet 了！记住：sugar 开头 sh 读 /ʃ/，像""书格""——书格里的 sugar 甜丝丝！","KET 核心词汇","听力 Part 2（做饮料/烘焙）；阅读 Part 3（健康/食谱）","a spoon of sugar（一勺糖）；too much sugar（糖太多）；sugar and milk（糖和牛奶）；brown sugar（红糖）","sugar（糖）vs salt（盐）——sugar 甜，salt 咸；做蛋糕用 sugar，做菜调味用 salt","Do you take sugar in your tea? 你喝茶加糖吗？","听对话判断""咖啡里加什么""，或阅读健康文章判断""sugar 摄入是否过多"""
"71","sweet","蔬菜水果","/swiːt/","adj. / n.","甜的；糖果（英式）","Sweet 来自古英语 swete（甜的），和 sugar 一样都和""甜""有关！它有两个身份：形容词""甜的""（sweet cake 甜蛋糕）和英式名词""糖果""（a bag of sweets 一袋糖果）。记住：sweet 既是味道，也是英国小朋友最爱的零食！","KET 核心词汇","听力 Part 2（描述味道/购物）；阅读 Part 3（英式生活/派对）","sweet food（甜食）；too sweet（太甜）；a bag of sweets（一袋糖果，英式）；sweet tooth（爱吃甜食）","sweet（英式糖果，复数 sweets）vs candy（美式糖果）——英国说 sweets，美国说 candy；sweet 作形容词=甜的","This cake is very sweet. 这蛋糕很甜。 / The shop sells sweets and chocolate. 这家店卖糖果和巧克力。","词性转换题：sweet 作形容词还是名词；阅读英式文本中 sweets 指""糖果""不是""甜的"""
"72","vegetable","蔬菜水果","/ˈvedʒtəbl/（英）  /ˈvedʒtəbl/（美）","n.","蔬菜","Vegetable 来自拉丁语 vegetare（生长），和""植物""有关！蔬菜就是可以吃的植物部分。拼写很长，可以拆成 vege（像 veggie 素食）+ table（桌子）——餐桌上的 vege 就是 vegetable（蔬菜）！","KET 核心词汇","听力 Part 2（健康饮食/购物）；阅读 Part 3（营养/食谱）","fresh vegetables（新鲜蔬菜）；eat more vegetables（多吃蔬菜）；vegetable soup（蔬菜汤）；green vegetables（绿色蔬菜）","vegetable（蔬菜）vs fruit（水果）——vegetable 是菜（如 carrot、onion），fruit 是水果（如 apple、grape）","You should eat five portions of fruit and vegetables a day. 你每天吃五份水果和蔬菜。","阅读健康建议题：判断哪些是 vegetables；听力购物清单勾选蔬菜类"
"73","carrot","蔬菜水果","/ˈkærət/","n.","胡萝卜","Carrot 来自希腊语 karōton（胡萝卜）。胡萝卜是橙色的，兔子最爱吃！carrot 读起来像""凯瑞特""——凯瑞特喂兔子一根 carrot。注意拼写：中间是 double r（两个 r）！","KET 核心词汇","听力 Part 2（购物/做沙拉）；阅读 Part 3（蔬菜列表/食谱）","a fresh carrot（一根新鲜胡萝卜）；carrot soup（胡萝卜汤）；grated carrot（胡萝卜丝）；carrot and stick（胡萝卜加大棒，引申义）","carrot（胡萝卜）vs parrot（鹦鹉）——carrot 是橙色蔬菜，parrot 是会说话的鸟，拼写差一个 p","Rabbits love eating carrots. 兔子最爱吃胡萝卜。","拼写题考 carrot 的双 r；阅读蔬菜分类题判断 carrot 属于 vegetable"
"74","onion","蔬菜水果","/ˈʌnjən/","n.","洋葱","Onion 来自拉丁语 unio（单一），因为洋葱是圆圆的""一个整体""。切 onion 时常常会流眼泪！记住：onion 读起来像""阿尼恩""——阿尼恩切 onion 时眼泪哗哗流！","KET 核心词汇","听力 Part 2（做菜/购物）；阅读 Part 3（食谱/厨房场景）","chop an onion（切洋葱）；fried onion（炒洋葱）；onion soup（洋葱汤）；a large onion（一个大洋葱）","onion（洋葱）vs union（联盟）——onion 是蔬菜，union 是""联合/联盟""，发音相近但意思完全不同","Chop the onion before you cook the meat. 做肉之前先把洋葱切好。","听做菜步骤排序：何时 chop the onion；阅读食谱勾选所需蔬菜"
"75","potato","蔬菜水果","/pəˈteɪtəʊ/（英）  /pəˈteɪtoʊ/（美）","n.","土豆","Potato 来自西班牙语 patata，原产于南美洲。它是高频词也是拼写陷阱：复数要加 -es 变成 potatoes（不是 potatos）！因为以 o 结尾的某些词复数加 -es。记住：一个 potato，两个 potatoes——o 后面跟 es！","KET 核心词汇","听力 Part 2（做菜/购物）；阅读 Part 3（拼写/食谱）","mashed potato（土豆泥）；baked potato（烤土豆）；potato chips（美式薯片）；a bag of potatoes（一袋土豆）","potato（土豆，复数 potatoes）vs tomato（番茄，复数 tomatoes）——两者复数都加 -es，是 KET 常考拼写点","We need three potatoes for the soup. 我们做汤需要三个土豆。","拼写题考 potatoes 复数加 -es；听力购物场景判断""买了几个 potato"""
"76","tomato","蔬菜水果","/təˈmɑːtəʊ/（英）  /təˈmeɪtoʊ/（美）","n.","番茄；西红柿","Tomato 来自西班牙语，原意是""大李子""。英国人读""特-马-头""，美国人读""特-梅-头""，发音差很多！复数要加 -es 变成 tomatoes，因为以 o 结尾的单词很多都这样——potato → potatoes，hero → heroes。","KET 核心词汇","听力 Part 2（超市购物/做菜）；阅读 Part 3（食谱/菜单）","tomato soup（番茄汤）；cherry tomato（小番茄）；tomato sauce（番茄酱）；fresh tomatoes（新鲜番茄）","tomato（番茄）vs potato（土豆）——tomato 是红的做沙拉，potato 是土豆做薯条；复数都是加 -es","I put two tomatoes in the salad. 我在沙拉里放了两个番茄。","听购物对话选""买了什么蔬菜""，或阅读食谱判断需要几个 tomatoes"
"77","mushroom","蔬菜水果","/ˈmʌʃruːm/（英）  /ˈmʊʃruːm/（美）","n.","蘑菇","Mushroom 可以拆成 mush + room——""蘑菇的小房间""！蘑菇像一把小伞，躲在阴湿的地方，就像住在自己的小房间里。Mush 还有""软软糊糊""的意思，刚采的蘑菇摸起来软软的，很好记！","KET 核心词汇","听力 Part 2（做饭/野餐）；阅读 Part 3（食物描述/森林场景）","fried mushrooms（炒蘑菇）；mushroom soup（蘑菇汤）；pick mushrooms（采蘑菇）；a slice of mushroom（一片蘑菇）","mushroom（蘑菇）vs room（房间）——mushroom 是食物，room 是房间；记住 mush+room 只是拆分记忆法","We had mushroom pizza for dinner. 我们晚餐吃了蘑菇披萨。","听对话选""披萨上有什么配料""，或在阅读野餐文章中找出含 mushroom 的菜品"
"78","fruit","蔬菜水果","/fruːt/","n.","水果","Fruit 和 friend 开头都是 fr，可以联想：朋友（friend）请你吃新鲜水果（fruit）！作""水果""总称时通常不可数，说 some fruit 不说 a fruit（表种类时可以说 an apple is a fruit）。","KET 核心词汇","听力 Part 2（健康饮食/购物）；阅读 Part 3（营养建议/市场描述）","fresh fruit（新鲜水果）；fruit juice（果汁）；eat more fruit（多吃水果）；a piece of fruit（一份水果）","fruit（水果，总称常不可数）vs vegetable（蔬菜）——fruit 是甜的、有籽的，vegetable 是蔬菜类","You should eat fruit every day. 你应该每天吃水果。","阅读健康建议题判断""每天该吃什么""，或听力中选""买了什么健康食品"""
"79","melon","蔬菜水果","/ˈmelən/","n.","甜瓜；瓜","Melon 来自希腊语，意思是""苹果大小的瓜""。夏天切开 melon，里面是红红或黄黄的，又甜又多汁！Watermelon（西瓜）= water + melon，就是""水分超多的瓜""。","KET 核心词汇","听力 Part 2（夏日野餐/水果店）；阅读 Part 3（季节食物描述）","watermelon（西瓜）；a slice of melon（一片甜瓜）；sweet melon（甜瓜）；melon juice（甜瓜汁）","melon（甜瓜/瓜）vs lemon（柠檬）——melon 是大圆的甜瓜，lemon 是小酸柠檬","This melon is very sweet and juicy. 这个甜瓜又甜又多汁。","听野餐对话选""带了什么水果""，或在阅读中区分 melon 和 lemon"
"80","garlic","蔬菜水果","/ˈɡɑːlɪk/（英）  /ˈɡɑːrlɪk/（美）","n.","大蒜；蒜","Garlic 来自古英语，gar 是""矛""，lic 是""菜""——蒜瓣尖尖的，像一把小矛！做菜时加 garlic 特别香，但口气也会很重。记住：gar 像""嘎""，lic 像""力克""——嘎力克，大蒜力克细菌！","KET 核心词汇","听力 Part 2（做菜/餐厅）；阅读 Part 3（食谱/意大利菜描述）","a clove of garlic（一瓣蒜）；garlic bread（蒜香面包）；add some garlic（加点蒜）；garlic sauce（蒜蓉酱）","garlic（大蒜）vs onion（洋葱）——garlic 瓣小、味冲，onion 是大圆的、切了会流泪","Add two cloves of garlic to the soup. 往汤里加两瓣蒜。","阅读食谱题选""需要什么调料""，或听力中判断""做菜加了什么"""
"81","aunt","家庭成员","/ɑːnt/（英）  /ænt/（美）","n.","阿姨；姑妈；舅妈；姨妈","Aunt 是爸爸妈妈的姐妹，或者叔叔舅舅的妻子。英国人读""昂特""（/ɑːnt/），美国人读""安特""（/ænt/），和 ant（蚂蚁）美式发音一样！可以联想：阿姨（aunt）和蚂蚁（ant）在美国人嘴里听起来一样——但 aunt 是大写、指人哦！","KET 核心词汇","听力 Part 2（家庭介绍/拜访亲戚）；阅读 Part 3（家庭树/人物关系）","my aunt（我的阿姨/姑妈）；visit my aunt（看望阿姨）；Aunt Mary（玛丽姑妈）；aunt and uncle（叔叔阿姨）","aunt（阿姨/姑妈）vs ant（蚂蚁）——美式发音相同，但拼写和意思完全不同；aunt 是 family 成员","My aunt lives in London. 我的姑妈住在伦敦。","听家庭介绍判断""谁住在伦敦""，或阅读家庭树选 aunt 对应的人物关系"
"82","boy","家庭成员","/bɔɪ/","n.","男孩","Boy 来自中古英语，原意是""仆人、少年""。和 girl 是一对反义词。发音像""博伊""，可以联想：男孩（boy）爱踢球，喊""Bo-y!""加油！","KET 核心词汇","听力 Part 2（学校/游乐场）；阅读 Part 3（人物描述/班级介绍）","a little boy（小男孩）；school boy（男学生）；boy and girl（男孩和女孩）；that boy over there（那边的男孩）","boy（男孩）vs girl（女孩）——boy 指男生，girl 指女生；复数 boys / girls","The boy is playing football in the park. 那个男孩在公园踢足球。","听录音描述人物选""男孩在做什么""，或阅读班级介绍判断有几个 boys"
"83","brother","家庭成员","/ˈbrʌðə/（英）  /ˈbrʌðər/（美）","n.","兄弟；哥哥；弟弟","Brother 来自古英语，和德语 Bruder 是亲戚词。Bro 是 brother 的口语缩写，好朋友也互称 bro！记住：brother 是""兄/弟""，sister 是""姐/妹""，合起来是兄弟姐妹。","KET 核心词汇","听力 Part 2（家庭介绍）；阅读 Part 3（家庭描述/兄弟姐妹）","my brother（我的兄弟/哥哥/弟弟）；big brother（哥哥）；little brother（弟弟）；brother and sister（兄妹/姐弟）","brother（兄弟）vs sister（姐妹）——brother 指男性兄弟姐妹，sister 指女性；older brother = 哥哥","I have one brother and two sisters. 我有一个哥哥/弟弟和两个姐姐/妹妹。","听家庭介绍判断""有几个兄弟姐妹""，或阅读选 brother 的家庭关系"
"84","dad","家庭成员","/dæd/","n.","爸爸（口语）","Dad 是 daddy 的缩写，小孩子最先学会的词之一！和 father 意思一样，但 dad 更亲切、更口语。发音""大大""，就像叫""爸爸""一样简单直接！","KET 核心词汇","听力 Part 2（家庭日常对话）；阅读 Part 3（日记/家庭活动）","my dad（我爸爸）；dad and mum（爸爸妈妈）；Dad's car（爸爸的车）；ask my dad（问我爸爸）","dad（爸爸，口语）vs father（父亲，较正式）——日常对话用 dad，正式场合或书面用 father","My dad drives me to school every day. 我爸爸每天开车送我去学校。","听家庭对话判断""谁送孩子上学""，或阅读日记找出 dad 做了什么"
"85","father","家庭成员","/ˈfɑːðə/（英）  /ˈfɑːðər/（美）","n.","父亲；爸爸","Father 来自古英语 fæder，和 mom/mother 一样，是全世界很多语言都有的""爸爸""词！比 dad 更正式，填表格、写贺卡时常用 father。Father's Day 就是""父亲节""。","KET 核心词汇","听力 Part 2（家庭/节日）；阅读 Part 3（正式介绍/贺卡）","my father（我的父亲）；Father's Day（父亲节）；father and mother（父母）；his father（他的父亲）","father（父亲，正式）vs dad（爸爸，口语）——father 用于正式场合，dad 用于日常聊天","My father works in a hospital. 我父亲在一家医院工作。","阅读正式家庭介绍选 father's job，或听力 Father's Day 相关对话"
"86","girl","家庭成员","/ɡɜːl/（英）  /ɡɜːrl/（美）","n.","女孩","Girl 来自古英语 gyrela，原意是""年轻人""。和 boy 是一对。发音""格尔""，可以联想：女孩（girl）扎着 curl（卷发）——girl 和 curl 押韵好记！","KET 核心词汇","听力 Part 2（学校/朋友）；阅读 Part 3（人物描述/班级）","a little girl（小女孩）；school girl（女学生）；boy and girl（男孩和女孩）；that girl with long hair（那个长发女孩）","girl（女孩）vs boy（男孩）——girl 指女生，boy 指男生","The girl is reading a book under the tree. 那个女孩在树下看书。","听人物描述选""女孩在做什么""，或阅读班级名单统计 girls 人数"
"87","grandma","家庭成员","/ˈɡrænmɑː/（英）  /ˈɡrænmɑː/（美）","n.","奶奶；外婆（口语）","Grandma = grand（隔代的）+ ma（妈妈）——""隔一层的妈妈""就是奶奶或外婆！正式说法是 grandmother，但日常叫 grandma 或 granny 更亲切。Grand 还有""宏伟""的意思，奶奶在你心里就是最伟大的人！","KET 核心词汇","听力 Part 2（家庭拜访/周末活动）；阅读 Part 3（家庭故事）","visit grandma（看望奶奶/外婆）；my grandma（我的奶奶）；Grandma's house（奶奶家）；grandma and grandpa（爷爷奶奶/外公外婆）","grandma（奶奶/外婆，口语）vs grandmother（祖母，正式）——意思相同，grandma 更口语化","I visit my grandma every Sunday. 我每个星期天都去看望奶奶。","听家庭对话判断""周末去看望谁""，或阅读家庭故事找出 grandma 的角色"
"88","grandpa","家庭成员","/ˈɡrænpɑː/（英）  /ˈɡrænpɑː/（美）","n.","爷爷；外公（口语）","Grandpa = grand + pa（爸爸）——""隔一层的爸爸""就是爷爷或外公！和 grandma 是一对。正式说法是 grandfather，但 grandpa 更温暖，很多爷爷喜欢孙子孙女叫 grandpa！","KET 核心词汇","听力 Part 2（家庭/节日）；阅读 Part 3（祖孙故事）","visit grandpa（看望爷爷/外公）；my grandpa（我的爷爷）；Grandpa's garden（爷爷的菜园）；grandpa and grandma（爷爷奶奶/外公外婆）","grandpa（爷爷/外公，口语）vs grandfather（祖父，正式）——拼写和正式程度不同，意思一样","My grandpa tells me stories before bed. 我爷爷睡前给我讲故事。","听祖孙对话判断""爷爷在做什么""，或阅读选 grandpa 的相关活动"
"89","mother","家庭成员","/ˈmʌðə/（英）  /ˈmʌðər/（美）","n.","母亲；妈妈","Mother 和 father 是经典父母配对词，来自古英语 modor。Mother's Day 是母亲节！比 mum/mom 更正式，和 father 一样常用于书面或正式介绍。","KET 核心词汇","听力 Part 2（家庭/节日）；阅读 Part 3（正式介绍/贺卡）","my mother（我的母亲）；Mother's Day（母亲节）；mother and father（父母）；his mother（他的母亲）","mother（母亲，正式）vs mum/mom（妈妈，口语）——mother 正式，mum（英）/ mom（美）口语","My mother cooks dinner for our family. 我妈妈给我们全家做晚餐。","阅读家庭介绍选 mother 的职业或活动，或听力 Mother's Day 相关题目"
"90","Mrs.","家庭成员","/ˈmɪsɪz/","n.（称谓）","夫人；太太；老师（对已婚女性的尊称）","Mrs. 是 Mistress 的缩写，用在已婚女性姓氏前，比如 Mrs. Smith（史密斯夫人/太太）。注意：发音是""米西兹""（/ˈmɪsɪz/），不是""密斯""！在学校，叫女老师 Mrs. + 姓，表示尊重。","KET 核心词汇","听力 Part 1/2（学校/正式介绍）；阅读 Part 5（书信/便条）","Mrs. Smith（史密斯夫人/老师）；Dear Mrs. Jones（亲爱的琼斯夫人）；Mrs. Brown, our teacher（布朗老师）","Mrs.（夫人，已婚）vs Miss（小姐，未婚）——Mrs. 用于已婚女性，Miss 用于未婚女性；都加在姓氏前","Mrs. Wang is our English teacher. 王老师是我们的英语老师。","阅读书信判断收信人称谓，或听力学校场景辨认 Mrs. + 姓氏"
"91","Miss","家庭成员","/mɪs/","n.（称谓）","小姐；老师（对未婚女性的尊称）","Miss 用在未婚女性姓氏前，比如 Miss Green（格林小姐/老师）。发音""密斯""，和 Mrs.（米西兹）不同！在学校叫 Miss + 姓，是对女老师的尊称。三个 M 称谓：Mr. 先生、Mrs. 夫人、Miss 小姐。","KET 核心词汇","听力 Part 1/2（学校/介绍）；阅读 Part 5（书信/通知）","Miss Lee（李小姐/老师）；Dear Miss White（亲爱的怀特小姐）；Miss, our maths teacher（我们的数学老师）","Miss（小姐，未婚）vs Mrs.（夫人，已婚）——Miss 未结婚，Mrs. 已结婚；拼写差一个 r","Miss Chen teaches us music. 陈老师教我们音乐。","阅读通知或书信选正确称谓，或听力判断如何称呼女老师"
"92","Mister","家庭成员","/ˈmɪstə/（英）  /ˈmɪstər/（美）","n.（称谓）","先生","Mister 就是 Mr. 的完整写法，用在男士姓氏前，比如 Mister Brown 或 Mr. Brown（布朗先生）。发音""米斯特""。记住：Mister/Mr. 对男士，Miss 对未婚女士，Mrs. 对已婚女士——三位一家！","KET 核心词汇","听力 Part 1/2（正式介绍/商店）；阅读 Part 5（书信/表格）","Mister Smith / Mr. Smith（史密斯先生）；Dear Mister Brown（亲爱的布朗先生）；Yes, Mister（是的，先生）","Mister/Mr.（先生）vs Miss（小姐）——Mr. 是缩写，Mister 是全称；都用于称呼","Mr. Zhang is our new teacher. 张先生是我们的新老师。","阅读正式信函判断对男士的称谓，或听力商店/学校场景辨认 Mr./Mister"
"93","son","家庭成员","/sʌn/","n.","儿子","Son 和 sun（太阳）发音一模一样，都是 /sʌn/！但 son 是""儿子""（家庭），sun 是""太阳""（天上）。记忆口诀：儿子（son）像太阳（sun）一样，是家里的""小太阳""！daughter 是女儿，和 son 相对。","KET 核心词汇","听力 Part 2（家庭介绍）；阅读 Part 3（家庭关系/拼写辨析）","my son（我的儿子）；son and daughter（儿子和女儿）；their son（他们的儿子）；only son（独子）","son（儿子）vs sun（太阳）——同音不同义、不同拼写；son 是 family，sun 是 sky","They have one son and one daughter. 他们有一个儿子和一个女儿。","阅读家庭介绍判断 son/daughter，或拼写题区分 son 和 sun 的语境"
"94","uncle","家庭成员","/ˈʌŋkl/","n.","叔叔；舅舅；姑父；姨父","Uncle 是爸爸妈妈的兄弟，或 aunt 的丈夫。和 aunt 是一对亲戚词！发音""安克尔""，开头的 un- 像""你的""，可以联想：uncle 是""你的长辈亲戚""。Bob's your uncle 是英式俚语，意思是""搞定了！""","KET 核心词汇","听力 Part 2（家庭拜访）；阅读 Part 3（家庭树/人物关系）","my uncle（我的叔叔/舅舅）；Uncle Tom（汤姆叔叔）；aunt and uncle（叔叔阿姨）；visit my uncle（看望叔叔）","uncle（叔叔/舅舅）vs aunt（阿姨/姑妈）——uncle 是男性长辈，aunt 是女性长辈","My uncle gave me a birthday present. 我叔叔/舅舅送了我一份生日礼物。","听家庭介绍判断 uncle 的角色，或阅读家庭树选 uncle 对应关系"
"95","armchair","居家","/ˈɑːmtʃeə/（英）  /ˈɑːrmtʃer/（美）","n.","扶手椅；单人沙发","Armchair = arm（手臂）+ chair（椅子）——有""扶手""的椅子！可以把胳膊搭在两边扶手上，舒服地坐着看书。Arm 是手臂，chair 是椅子，合起来就是""有手臂支撑的椅子""。","KET 核心词汇","听力 Part 2（描述房间/家具）；阅读 Part 3（家居/酒店描述）","sit in an armchair（坐在扶手椅里）；a comfortable armchair（一张舒适的扶手椅）；leather armchair（皮扶手椅）；by the armchair（在扶手椅旁）","armchair（扶手椅）vs chair（普通椅子）——armchair 有扶手、更大更软，chair 是普通椅子","Grandpa likes reading in his armchair. 爷爷喜欢坐在他的扶手椅里看书。","听房间描述判断""有什么家具""，或阅读家居文章找出 armchair 的位置"
"96","bathroom","居家","/ˈbɑːθruːm/（英）  /ˈbæθruːm/（美）","n.","浴室；卫生间","Bathroom = bath（洗澡）+ room（房间）——""洗澡的房间""！虽然很多 bathroom 也有马桶，但英文里 bathroom 本意是浴室。美国人常说 ""Where's the bathroom?"" 意思是找卫生间。Bath 是洗澡，room 是房间。","KET 核心词汇","听力 Part 2（描述房屋/问路）；阅读 Part 3（公寓/酒店描述）","go to the bathroom（去卫生间）；a big bathroom（大浴室）；bathroom mirror（浴室镜子）；clean the bathroom（打扫卫生间）","bathroom（浴室/卫生间）vs bedroom（卧室）——bathroom 洗澡用，bedroom 睡觉用；都有 room","The bathroom is next to the bedroom. 卫生间在卧室旁边。","听房屋介绍判断 bathroom 位置，或阅读公寓描述选房间功能"
"97","bed","居家","/bed/","n.","床","Bed 来自古英语 bedd，发音和拼写一样短——/bed/！Go to bed 是""上床睡觉""。Bed 还是 bedroom（卧室）的第一个词：bed + room = 放床的房间。","KET 核心词汇","听力 Part 2（日常作息/房间）；阅读 Part 3（卧室描述）","go to bed（上床睡觉）；make the bed（铺床）；in bed（在床上）；a single/double bed（单人/双人床）","bed（床）vs bad（坏的）——bed 中间是 e，bad 中间是 a；bed 是家具，bad 是形容词","I go to bed at nine o'clock. 我九点上床睡觉。","听日常作息选""几点睡觉""，或阅读卧室描述找出 bed 相关细节"
